<?xml version="1.0"?>
<xs:schema xmlns:xs="http://www.w3.org/2001/XMLSchema"
           targetNamespace="http://www.w3school.com.cn"
           xmlns="http://www.w3school.com.cn"
           elementFormDefault="qualified">
    <xs:element name="test_data" >
        <xs:complexType>
            <xs:sequence>
                <xs:element name="data_set" maxOccurs="unbounded">
                    <xs:complexType>
                        <xs:sequence>
                            <xs:element name="data" maxOccurs="unbounded">
                                <xs:complexType>
                                    <xs:attribute name="name" type="xs:string" use="required"/>
                                    <xs:attribute name="value" type="xs:string" use="required"/>
                                </xs:complexType>
                            </xs:element>
                        </xs:sequence>
                        <xs:attribute name="name" type="xs:string" use="required"/>
                    </xs:complexType>
                </xs:element>
            </xs:sequence>
        </xs:complexType>
        <xs:unique name="数据集名不可重复">
            <xs:selector xpath="./*"/>
            <xs:field xpath="@name"/>
        </xs:unique>
    </xs:element>
</xs:schema>